{"schema_version":"2.0","engine_version":"0.2.0","repository_id":"fuzz/empty","commit_sha":null,"configuration_id":"dd06ff50cc7284e4edca9316018cdf28b22e6581e64ad3eca7a499418fcea0ac","selection_id":"42ee89f2889b3c1ce31beb3a5e9eb4d1ec60c2aa3dcd9bf33f7d231d9e154a39","snapshot_id":"a57aa12593607ae37733ee9d4e8ded5418a136718d27859691f9da21fc68ad6b","complete":true,"files":[]}
